{
  "schema_version": "1.0",
  "experience_id": "exp:akath-mm-0001",
  "task_id": "AKATH-MULTIMODAL-LEARNING-001",
  "created_at": "2026-10-25T12:00:00.000Z",
  "input": {
    "modalities": ["image", "audio"],
    "evidence": [
      {
        "sha256": "0a1b2c3d4e5f60718293a4b5c6d7e8f90a1b2c3d4e5f60718293a4b5c6d7e8f9",
        "uri": "evidence://fixture/sample-image",
        "source": "test-fixture",
        "captured_at": "2026-10-25T11:59:00.000Z",
        "license_or_permission": "fixture-generated",
        "redacted": true
      }
    ]
  },
  "perception": [
    {
      "modality": "image",
      "tool": "fixture-parser",
      "version": "1.0",
      "summary": "A single sample frame",
      "confidence": 0.99,
      "timestamp_ms": 0,
      "evidence_sha256": "0a1b2c3d4e5f60718293a4b5c6d7e8f90a1b2c3d4e5f60718293a4b5c6d7e8f9"
    }
  ],
  "context": {
    "situation": "fixture",
    "hypothesis": "a well-formed record validates",
    "constraints": ["no network access"]
  },
  "plan": ["validate the record against the schema"],
  "actions": [
    {
      "action": "validate",
      "result": "success",
      "evidence_sha256": "0a1b2c3d4e5f60718293a4b5c6d7e8f90a1b2c3d4e5f60718293a4b5c6d7e8f9",
      "idempotency_key": "exp:akath-mm-0001"
    }
  ],
  "outcome": {
    "expected_postconditions": ["record accepted"],
    "observed": "record accepted",
    "metrics": { "errors": 0 }
  },
  "verification": {
    "status": "PASS",
    "verifier": "independent-fixture-check",
    "evidence": ["test://akath-mm-0001/validation-output"],
    "reasons": [],
    "verified_at": "2026-10-25T12:00:01.000Z"
  },
  "lesson": {
    "candidate": "the schema validation is repeatable",
    "confidence": 1,
    "review_state": "CANDIDATE",
    "applicability": ["schema validation"],
    "contradictions": []
  },
  "privacy": {
    "classification": "INTERNAL",
    "redaction_complete": true,
    "retention_policy": "test fixture only; no real media"
  }
}
